{
  "version": 3,
  "id": "presentadora-coral-v1",
  "kind": "character",
  "canvas": {
    "width": 1080,
    "height": 1920
  },
  "pivot": {
    "x": 540,
    "y": 960
  },
  "sourceDefinition": "assets/resource-definitions/presentadora-modular-v1.json",
  "variant": {
    "id": "coral",
    "label": "Presentadora coral",
    "palette": {
      "skin": "#d99b76",
      "hair": "#3b2431",
      "outfit": "#e45b62",
      "outfitDark": "#a83e50",
      "shirt": "#f7e8d4",
      "pants": "#253252",
      "shoes": "#171c2d",
      "outline": "#241c2a",
      "eye": "#30223a",
      "mouthDark": "#4c2131",
      "tongue": "#d96776",
      "accent": "#f2c14e"
    }
  },
  "parts": [
    {
      "id": "legs",
      "parentId": "torso",
      "pivot": {
        "x": 540,
        "y": 1160
      },
      "zIndex": -10,
      "layer": "part_legs.png"
    },
    {
      "id": "torso",
      "parentId": null,
      "pivot": {
        "x": 540,
        "y": 960
      },
      "zIndex": 0,
      "layer": "part_torso.png"
    },
    {
      "id": "arm_left",
      "parentId": "torso",
      "pivot": {
        "x": 380,
        "y": 900
      },
      "zIndex": 5,
      "layer": "part_arm_left.png"
    },
    {
      "id": "arm_right",
      "parentId": "torso",
      "pivot": {
        "x": 700,
        "y": 900
      },
      "zIndex": 15,
      "layer": "part_arm_right.png"
    },
    {
      "id": "head",
      "parentId": "torso",
      "pivot": {
        "x": 540,
        "y": 650
      },
      "zIndex": 20,
      "layer": "part_head.png"
    }
  ],
  "stateParentPartId": "head",
  "states": {
    "eyes": {
      "open": "eyes_open.png",
      "closed": "eyes_closed.png"
    },
    "mouth": {
      "closed": "mouth_closed.png",
      "medium": "mouth_medium.png",
      "open": "mouth_open.png",
      "round": "mouth_round.png",
      "labiodental": "mouth_labiodental.png",
      "bilabial": "mouth_bilabial.png"
    },
    "thumbnails": {
      "neutral": "pose_neutral.png",
      "point": "pose_point.png",
      "celebrate": "pose_celebrate.png",
      "doubt": "pose_doubt.png",
      "deny": "pose_deny.png"
    }
  },
  "poses": [
    {
      "id": "neutral",
      "parts": [
        {
          "partId": "arm_right",
          "rotationDegrees": 0
        },
        {
          "partId": "arm_left",
          "rotationDegrees": 0
        }
      ]
    },
    {
      "id": "point",
      "parts": [
        {
          "partId": "arm_right",
          "rotationDegrees": -48
        },
        {
          "partId": "arm_left",
          "rotationDegrees": 0
        }
      ]
    },
    {
      "id": "celebrate",
      "parts": [
        {
          "partId": "arm_right",
          "rotationDegrees": -100
        },
        {
          "partId": "arm_left",
          "rotationDegrees": 100
        }
      ]
    },
    {
      "id": "doubt",
      "parts": [
        {
          "partId": "arm_right",
          "rotationDegrees": -22
        },
        {
          "partId": "arm_left",
          "rotationDegrees": 38
        }
      ]
    },
    {
      "id": "deny",
      "parts": [
        {
          "partId": "arm_right",
          "rotationDegrees": -15
        },
        {
          "partId": "arm_left",
          "rotationDegrees": 15
        }
      ]
    }
  ],
  "parameters": [
    {
      "id": "armRaise",
      "minimum": 0,
      "maximum": 1,
      "default": 0
    },
    {
      "id": "leftArmRaise",
      "minimum": 0,
      "maximum": 1,
      "default": 0
    },
    {
      "id": "headTilt",
      "minimum": -1,
      "maximum": 1,
      "default": 0
    },
    {
      "id": "headNod",
      "minimum": 0,
      "maximum": 1,
      "default": 0
    },
    {
      "id": "bodyLean",
      "minimum": -1,
      "maximum": 1,
      "default": 0
    },
    {
      "id": "bodyBounce",
      "minimum": 0,
      "maximum": 1,
      "default": 0
    }
  ],
  "bindings": [
    {
      "parameterId": "armRaise",
      "partId": "arm_right",
      "channel": "rotationDegrees",
      "from": 0,
      "to": -100
    },
    {
      "parameterId": "leftArmRaise",
      "partId": "arm_left",
      "channel": "rotationDegrees",
      "from": 0,
      "to": 100
    },
    {
      "parameterId": "headTilt",
      "partId": "head",
      "channel": "rotationDegrees",
      "from": -12,
      "to": 12
    },
    {
      "parameterId": "headNod",
      "partId": "head",
      "channel": "offsetY",
      "from": 0,
      "to": 24
    },
    {
      "parameterId": "bodyLean",
      "partId": "torso",
      "channel": "rotationDegrees",
      "from": -8,
      "to": 8
    },
    {
      "parameterId": "bodyBounce",
      "partId": "torso",
      "channel": "offsetY",
      "from": 0,
      "to": -34
    }
  ],
  "provenance": {
    "source": "Diseño geométrico y rig articulado original del paquete interno de personajes V1.",
    "license": "Asset propietario original habilitado para uso comercial en el producto."
  }
}
