{
  "version": 3,
  "id": "el-peque-v1",
  "kind": "character",
  "canvas": {
    "width": 1080,
    "height": 1920
  },
  "pivot": {
    "x": 540,
    "y": 960
  },
  "sourceDefinition": "assets/resource-definitions/el-peque-v1.json",
  "variant": {
    "id": "default",
    "label": "El peque",
    "palette": {
      "outline": "#1a1a1a",
      "skin": "#ffccb6",
      "hair": "#2c1b18",
      "bandana": "#e32d40",
      "shirt": "#f0f0f0",
      "vest": "#2b2b2b",
      "pants": "#2b3b4b",
      "tattoo": "#2c3e50",
      "mouthDark": "#3a1720",
      "tongue": "#ef7c78",
      "white": "#ffffff"
    }
  },
  "parts": [
    {
      "id": "torso",
      "parentId": null,
      "pivot": {
        "x": 540,
        "y": 960
      },
      "zIndex": 0,
      "layer": "part_torso.png"
    },
    {
      "id": "legs",
      "parentId": "torso",
      "pivot": {
        "x": 540,
        "y": 1200
      },
      "zIndex": -10,
      "layer": "part_legs.png"
    },
    {
      "id": "head",
      "parentId": "torso",
      "pivot": {
        "x": 540,
        "y": 700
      },
      "zIndex": 20,
      "layer": "part_head.png"
    },
    {
      "id": "arm_left",
      "parentId": "torso",
      "pivot": {
        "x": 420,
        "y": 780
      },
      "zIndex": 5,
      "layer": "part_arm_left.png"
    },
    {
      "id": "arm_right",
      "parentId": "torso",
      "pivot": {
        "x": 660,
        "y": 780
      },
      "zIndex": 15,
      "layer": "part_arm_right.png"
    }
  ],
  "stateParentPartId": "head",
  "states": {
    "eyes": {
      "open": "eyes_open.png",
      "closed": "eyes_closed.png"
    },
    "mouth": {
      "closed": "mouth_closed.png",
      "medium": "mouth_medium.png",
      "open": "mouth_open.png",
      "round": "mouth_round.png",
      "labiodental": "mouth_labiodental.png",
      "bilabial": "mouth_bilabial.png"
    },
    "thumbnails": {
      "neutral": "pose_neutral.png",
      "point": "pose_point.png",
      "celebrate": "pose_celebrate.png",
      "doubt": "pose_doubt.png",
      "deny": "pose_deny.png"
    }
  },
  "poses": [
    {
      "id": "neutral",
      "parts": [
        {
          "partId": "arm_right",
          "rotationDegrees": 0
        }
      ]
    },
    {
      "id": "point",
      "parts": [
        {
          "partId": "arm_right",
          "rotationDegrees": -45
        }
      ]
    },
    {
      "id": "celebrate",
      "parts": [
        {
          "partId": "arm_right",
          "rotationDegrees": -90
        }
      ]
    },
    {
      "id": "doubt",
      "parts": [
        {
          "partId": "arm_right",
          "rotationDegrees": -25
        }
      ]
    },
    {
      "id": "deny",
      "parts": [
        {
          "partId": "arm_right",
          "rotationDegrees": -10
        }
      ]
    }
  ],
  "parameters": [
    {
      "id": "armRaise",
      "minimum": 0,
      "maximum": 1,
      "default": 0
    },
    {
      "id": "leftArmRaise",
      "minimum": 0,
      "maximum": 1,
      "default": 0
    },
    {
      "id": "headTilt",
      "minimum": -1,
      "maximum": 1,
      "default": 0
    },
    {
      "id": "headNod",
      "minimum": 0,
      "maximum": 1,
      "default": 0
    },
    {
      "id": "bodyLean",
      "minimum": -1,
      "maximum": 1,
      "default": 0
    },
    {
      "id": "bodyBounce",
      "minimum": 0,
      "maximum": 1,
      "default": 0
    }
  ],
  "bindings": [
    {
      "parameterId": "armRaise",
      "partId": "arm_right",
      "channel": "rotationDegrees",
      "from": 0,
      "to": -95
    },
    {
      "parameterId": "leftArmRaise",
      "partId": "arm_left",
      "channel": "rotationDegrees",
      "from": 0,
      "to": 95
    },
    {
      "parameterId": "headTilt",
      "partId": "head",
      "channel": "rotationDegrees",
      "from": -12,
      "to": 12
    },
    {
      "parameterId": "headNod",
      "partId": "head",
      "channel": "offsetY",
      "from": 0,
      "to": 24
    },
    {
      "parameterId": "bodyLean",
      "partId": "torso",
      "channel": "rotationDegrees",
      "from": -8,
      "to": 8
    },
    {
      "parameterId": "bodyBounce",
      "partId": "torso",
      "channel": "offsetY",
      "from": 0,
      "to": -34
    }
  ],
  "provenance": {
    "source": "Diseño original de rockstar tatuador 'El peque'.",
    "license": "Asset original para uso interno del proyecto."
  }
}
